Card,Entrepreneurial Activation,
A♥,"Focus: Personal motivation, emotional clarity, starting something that matters to you.
Aligned Actions: Redefine what lights you up. Launch a heart-centered offer. Reconnect with your “why.” Schedule creative solo time. Explore ways your business can feel more like you, less like pressure. This is a good time for self-care upgrades and realignment.",
A♣,"Focus: New ideas, mental clarity, learning something fresh.
Aligned Actions: Take a course, write content, brainstorm without editing. Launch that podcast or lead magnet. Say yes to curiosity. Just don’t overthink it—done is better than perfect. This is about flexing your brain and letting ideas take form.",
A♦,"Focus: New financial ideas, values-based income, profit with purpose.
Aligned Actions: Price your offers with more alignment. Launch a value-driven offer. Revisit your money mindset and spending patterns. It’s a great time to create a new stream of income that actually reflects what you care about.",
A♠,"Focus: Identity upgrade, internal transformation, the “begin again” moment.
Aligned Actions: Do a brand audit. Reevaluate how your business reflects who you are now. Create content that shares your story. Take the leap you've been circling. This is a powerful time for soul-level alignment and letting go of the masks.",
2♥,"Focus: Emotional connection, relationships, building meaningful partnerships.
Aligned Actions: Nurture your best business relationships. Book 1:1 calls with clients or collaborators. Share your story to create emotional resonance. This is a great time to form a new JV, launch a relationship-centered offer, or create loyalty programs for your community.",
2♣,"Focus: Communication, collaboration, and exchanging ideas.
Aligned Actions: Host a workshop, co-create content, pitch a guest podcast or blog feature. Don’t go it alone—your best ideas will come through dialogue. It’s a great time to develop messaging that truly reflects your voice and values.",
2♦,"Focus: Business partnerships, aligned collaborations, shared money goals.
Aligned Actions: Negotiate a win-win deal. Create a strategic partnership or affiliate arrangement. Be mindful of your values in shared ventures. Financial teamwork can spark growth if both sides are aligned.",
2♠,"Focus: Co-working, aligned action with others, support systems.
Aligned Actions: Hire a VA. Build your team. Create backend systems together. This is the time to lean on others and stop carrying it all yourself. Trust and collaboration are your growth tools.
 ",
3♥,"Focus: Emotional creativity, expressing what you feel, joyful flexibility.
Aligned Actions: Create from the heart—think storytelling, community events, or playful content. Let go of “perfect.” This card is about lightening up and experimenting with what feels good. Don’t be surprised if you change your mind mid-project. That’s the magic.",
3♣,"Focus: Creative thinking, strategy with soul, innovative communication.
Aligned Actions: Launch something you’ve been mentally noodling on. Break the mold with how you share your message. Brainstorm, teach, speak. This is your time to play with possibility and still keep it purposeful.",
3♦,"Focus: Value evolution, pivoting your profit model, creative entrepreneurship.
Aligned Actions: Audit your business offers. Play with new pricing. Combine your passions into a new stream of income. This is your permission slip to do business your way—even if it breaks the rules.",
3♠,"Focus: Doing things differently, mind-body balance, resilience through growth.
Aligned Actions: Try a new workflow. Integrate wellness into your work schedule. Build something sustainable, not just scalable. You may feel pulled in multiple directions—clarity will come through movement, not overthinking.
 ",
4♥,"Focus: Focus: Emotional foundation, stability, loyalty.
Aligned Actions: Strengthen your team. Reconnect with your community. Create content or offers that make people feel emotionally safe and seen. This is a great time to build customer loyalty or design systems that feel like a warm hug—structured, but caring.Emotional foundation, stability, loyalty.",
4♣,"Focus: Focus: Mental structure, focus, clear communication.
Aligned Actions: Get your SOPs in order. Simplify your messaging. Outline that course. Cut the fluff in your marketing. It’s time to double down on clarity and clean systems that support long-term growth.Mental structure, focus, clear communication.",
4♦,"Focus: FinanFocus: Financial structure, consistency, grounded growth.
Aligned Actions: Review your revenue streams. Build a budget that reflects your actual values—not just your goals. Streamline what works. This is your “chop wood, carry water” card. It’s not sexy, but it sets you up for serious stability.cial structure, consistency, grounded growth.",
4♠,"Focus: Health, work-life balance, creating a sustainable workflow.
Aligned Actions: Audit your calendar. Prioritize wellness. Rebuild your schedule around your energy, not just your deadlines. This is the card of true CEO wellness—body, business, and boundaries.
 ",
5♥,"Focus: Emotional freedom, change in relationships, heart-led evolution.
Aligned Actions: Let go of emotional patterns that no longer serve your leadership. Update how you connect with your audience or team. Launch something that reflects your current truth. Give yourself permission to pivot without guilt.",
5♣,"Focus: Mental change, innovation, disrupting the way you think or teach.
Aligned Actions: Rethink your messaging. Experiment with new content formats. Change the way you deliver your genius—try video, a challenge, or a new framework. This is your “break the box” card.",
5♦,"Focus: Financial freedom, value shifts, unconventional success.
Aligned Actions: Redefine what success actually looks like for you. Let go of outdated pricing, scarcity models, or client dynamics that drain you. Align your money moves with your soul, not just your spreadsheet.",
5♠,"Focus: Work and wellness reinvention, body intelligence, radical shifts.
Aligned Actions: Change your routine. Shift your workspace. Let your physical and mental health take the lead in your business planning. This is a total “reset the system” energy—let it help you rebuild better.
 ",
6♥,"Focus: Relationship responsibility, emotional alignment, karmic clarity.
Aligned Actions: Reflect on how your business impacts others. Revisit client boundaries, contracts, and expectations. This is a powerful time to clean up emotional debt and step into your role as a conscious leader. Own your impact.",
6♣,"Focus: Purposeful communication, aligned messaging, accountability in leadership.
Aligned Actions: Speak up with confidence. Teach what you’ve mastered. Share lessons that come from experience, not theory. Step into visibility with maturity. Your voice holds weight—use it intentionally.",
6♦,"Focus: Financial accountability, balance between giving and receiving.
Aligned Actions: Review your pricing. Audit your generosity—are you giving from overflow or obligation? Revisit your money boundaries. Step into empowered exchange and long-term abundance by owning your value.",
6♠,"Focus: Spiritual discipline, long-term alignment, cause and effect.
Aligned Actions: Stay the course. Make decisions based on integrity, not urgency. Build with legacy in mind. This is not the time for shortcuts—slow, steady, and soul-aligned wins the race.",
7♥,"Focus: Emotional truth, letting go of validation, heart-centered maturity.
Aligned Actions: Release the need to be liked. Speak honestly, even if it’s uncomfortable. Say no with love. Redefine what emotional leadership means for you. It’s time to lead from truth, not people-pleasing.",
7♣,"Focus: Mindset evolution, conscious thinking, mental clarity.
Aligned Actions: Challenge your limiting beliefs. Upgrade your thought patterns. Teach from lived wisdom. This is your “lead by what you’ve overcome” moment. Mental alchemy is your superpower now.",
7♦,"Focus: Wealth consciousness, values-based income, spiritual abundance.
Aligned Actions: Journal about your money stories. Rewire your income goals to match your soul goals. Give without attachment. Receive without guilt. It’s time to step into overflow by trusting you’re already worthy.",
7♠,"Focus: Inner healing, spiritual integration, body-soul harmony.
Aligned Actions: Prioritize rest. Trust your body’s wisdom. Take time off social. Say no to hustle culture. Align your business with your nervous system, not just your ambition. This is the spiritual CEO detox card.",
8♥,"Focus: Emotional power, magnetic leadership, influence through connection.
Aligned Actions: Host a live event. Share a vulnerable story. Uplift your team or audience with intentional affirmation. This is your time to show up, speak up, and let your heart do the heavy lifting. Your presence is the strategy.",
8♣,"Focus: Mental discipline, focus, confident communication.
Aligned Actions: Launch the thing. Teach the class. Claim your expertise publicly. Don’t water down your voice. You know your stuff—now own it. Clear, bold, consistent messaging is your edge.",
8♦,"Focus: Material mastery, wealth strategy, high-value influence.
Aligned Actions: Raise your rates. Pitch a bigger offer. Stand behind your numbers. You’ve earned the spotlight. Lead with confidence, not explanation. Abundance responds to certainty.",
8♠,"Focus: Mastery through work, energetic endurance, aligned action.
Aligned Actions: Tackle the thing you’ve been avoiding. Lead with presence. Get in the trenches with your team without losing your power. You’re built for this. Just don’t confuse hustle with purpose—work with soul, not stress.",
9♥,"Focus: Emotional release, closing cycles, conscious compassion.
Aligned Actions: Let something go—an offer, a dynamic, an old narrative. Make room for what actually fulfills you. Share a story of release with your audience. Show people what graceful evolution looks like.",
9♣,"Focus: Mental breakthroughs, message refinement, thought leadership.
Aligned Actions: Rethink your brand voice. Teach from experience, not ego. Close the loop on an old belief system. Say what others are afraid to say. This is a graduation moment—honor how far your mindset has come.",
9♦,"Focus: Value shift, brand rebirth, aligned prosperity.
Aligned Actions: Let go of anything that no longer reflects your worth—pricing, partnerships, positioning. Refresh your brand. Relaunch something from a place of soul instead of survival. This is the glow-up card.",
9♠,"Focus: Spiritual closure, deep healing, internal release.
Aligned Actions: End a chapter—gracefully. Create space for grief, growth, and rebirth. Say goodbye to old expectations. Trust the invisible progress. You’re shedding layers to lead with more truth.",
10♥,"Focus: Visibility, joy, connection at scale.
Aligned Actions: Go public. Host an event. Lead a celebration in your community. Share a win and let people feel it with you. This card is about big-hearted leadership—make others feel included in your impact.",
10♣,"Focus: Thought leadership, teaching at scale, mental mastery.
Aligned Actions: Launch the course. Write the book. Create evergreen content. This is your time to own your voice as an expert and leave a legacy of wisdom. Don’t just inform—transform.",
10♦,"Focus: Scalable income, profitable visibility, big-money moves.
Aligned Actions: Pitch the investors. Launch the signature offer. Share your money wins with pride. Expand without apology. This is abundance with a megaphone—lead with both numbers and intention.",
10♠,"Focus: Sustainable success, whole-life alignment, embodied power.
Aligned Actions: Audit your entire ecosystem—team, time, habits, health. Lead your business like a business. Stop treating success like a hustle badge and start embodying it as a lifestyle. This is the CEO power card—own it.",
J♥,"Focus: Creative expression, emotional leadership, connection.
Aligned Actions: Lead with heart. Host a workshop or creative retreat to engage your team or clients. Foster authentic relationships through creative collaborations. This is your time to show vulnerability and leadership—make people feel seen and heard.",
J♣,"Focus: Innovation, intellectual expansion, thought leadership.
Aligned Actions: Launch a new idea. Start a podcast. Share your insights and thought leadership with a wider audience. This is your moment to become the voice of creativity and innovation in your field—don’t just share ideas, make waves.",
J♦,"Focus: Financial creativity, wealth-building innovation, financial expansion.
Aligned Actions: Experiment with a new investment strategy. Diversify your revenue streams. Make bold financial decisions that align with your creative visions. This is your time to bring money and ideas together—expand your empire with intentional innovation.",
J♠,"Focus: Strategic innovation, transformative leadership, visionary planning.
Aligned Actions: Brainstorm big, bold ideas and put them into action. Lead a team-wide innovation challenge. Revamp your operational strategies to create smarter, more efficient workflows. This card is about turning vision into tangible, impactful action—don’t hold back.",
Q♥,"Focus: Emotional intelligence, nurturing leadership, connection at scale.
Aligned Actions: Cultivate deep, empathetic relationships with your team and clients. Lead with compassion—host a wellness program or team-building retreat to strengthen bonds. This card is about leading with love and creating spaces where people feel supported and seen.",
Q♣,"Focus: Mastery in communication, intellectual empowerment, team growth.
Aligned Actions: Develop and deliver thought-provoking content. Host workshops to share your expertise. Lead with clarity and wisdom—help others elevate their minds and skills. This is your time to share your knowledge and empower others to succeed.",
Q♦,"Focus: Financial wisdom, value-driven success, material mastery.
Aligned Actions: Launch a new product line or investment opportunity. Share your financial knowledge with others through workshops or consulting. This card is about building wealth through both strategy and integrity—create financial systems that align with your values.",
Q♠,"Focus: Strategic leadership, operational wisdom, long-term success.
Aligned Actions: Audit your company’s systems and refine operational strategies. Host leadership development sessions to instill wise decision-making. This is the time to integrate wisdom into every area of your business—focus on building sustainable success for the long haul.",
K♥,"Focus: Emotional mastery, leadership through empathy, creating deep connections.
Aligned Actions: Lead with compassion and authority. Develop mentorship programs focused on emotional intelligence. Cultivate a workplace where emotional well-being is prioritized. This card is about balancing leadership with care, making others feel supported and valued while driving results.",
K♣,"Focus: Intellectual leadership, strategy, and vision.
Aligned Actions: Launch strategic initiatives that challenge and expand your company’s intellectual capacity. Create opportunities for employees to lead brainstorming sessions. This is your time to shine as a thought leader—foster innovation and strategic planning that elevates the entire team.",
K♦,"Focus: Financial stewardship, material wealth, long-term value creation.
Aligned Actions: Lead with financial strategy—implement new profit-sharing models or optimize investment strategies. Build systems that support sustainable wealth creation. This card is about guiding your business toward long-term prosperity with ethical and responsible financial practices.",
K♠,"Focus: Strategic mastery, wisdom in leadership, sustainable success.
Aligned Actions: Focus on long-term business sustainability through thoughtful leadership and strategic decision-making. Lead operational audits to ensure alignment with your business goals. This is your time to embrace your role as the ultimate decision-maker—embody leadership that creates lasting impact.",
,,
,,
,,
,,
,,
,,
,,
,,
,,
,,
,,
,,
,,
,,
,,
,,
,,
,,
,,
,,
,,
,,
,,
,,